{
  "id": "CPA2019-CH4-S38-2",
  "node_type": "section",
  "act_id": "CPA2019",
  "chapter_number": 4,
  "section_number": "38",
  "subsection_number": "(2)",
  "term": null,
  "definition": null,
  "official_text": "Where the complaint relates to any goods, the District Commission shall,— (a) refer a copy of the admitted complaint, within twenty-one days from the date of its admission to the opposite party mentioned in the complaint directing him to give his version of the case within a period of thirty days or such extended period not exceeding fifteen days as may be granted by it; (b) if the opposite party on receipt of a complaint referred to him under clause (a) denies or disputes the allegations contained in the complaint, or omits or fails to take any action to represent his case within the time given by the District Commission, proceed to settle the consumer dispute in the manner specified in clauses (c) to (g); (c) if the complaint alleges a defect in the goods which cannot be determined without proper analysis or test of the goods, obtain a sample of the goods from the complainant, seal it and authenticate it in the manner as may be prescribed and refer the sample so sealed to the appropriate laboratory along with a direction that such laboratory to make an analysis or test, whichever may be necessary, with a view to finding out whether such goods suffer from any defect alleged in the complaint or from any other defect and to report its findings thereon to the District Commission within a period of forty-five days of the receipt of the reference or within such extended period as may be granted by it; (d) before any sample of the goods is referred to any appropriate laboratory under clause (c), require the complainant to deposit to the credit of the Commission such fees as may be specified, for payment to the appropriate laboratory for carrying out the necessary analysis or test in relation to the goods in question; (e) remit the amount deposited to its credit under clause (d) to the appropriate laboratory to enable it to carry out the analysis or test mentioned in clause (c) and on receipt of the report from the appropriate laboratory, it shall forward a copy of the report along with such remarks as it may feel appropriate to the opposite party; (f) if any of the parties disputes the correctness of the findings of the appropriate laboratory, or disputes the correctness of the methods of analysis or test adopted by the appropriate laboratory, require the opposite party or the complainant to submit in writing his objections with regard to the report made by the appropriate laboratory; (g) give a reasonable opportunity to the complainant as well as the opposite party of being heard as to the correctness or otherwise of the report made by the appropriate laboratory and also as to the objection made in relation thereto under clause (f) and issue an appropriate order under section 39.",
  "citations": [
    {
      "act": "Consumer Protection Act, 2019",
      "chapter": "IV",
      "section": "38",
      "subsection": "(2)"
    }
  ],
  "references": [
    {
      "target": "CPA2019-CH4-S39",
      "relation": "refers_to"
    }
  ],
  "metadata": {
    "jurisdiction": "India",
    "language": "en",
    "version": "2019"
  }
}