{
  "id": "CPA2019-CH4-S64",
  "node_type": "section",
  "act_id": "CPA2019",
  "chapter_number": 4,
  "section_number": "64",
  "subsection_number": "",
  "term": null,
  "definition": null,
  "official_text": "No act or proceeding of the District Commission, the State Commission or the National Commission shall be invalid by reason only of the existence of any vacancy amongst its members or any defect in the constitution thereof.",
  "citations": [
    {
      "act": "Consumer Protection Act, 2019",
      "chapter": "IV",
      "section": "64",
      "subsection": ""
    }
  ],
  "references": [],
  "metadata": {
    "jurisdiction": "India",
    "language": "en",
    "version": "2019"
  }
}