{
  "id": "CPA2019-CH8-S96-3",
  "node_type": "section",
  "act_id": "CPA2019",
  "chapter_number": 8,
  "section_number": "96",
  "subsection_number": "(3)",
  "term": null,
  "definition": null,
  "official_text": "Nothing in sub-section (1) shall apply to person who commits the same or similar offence, within a period of three years from the date on which the first offence, committed by him, was compounded. Explanation.—For the purposes of this sub-section, any second or subsequent offence committed after the expiry of a period of three years from the date on which the offence was previously compounded, shall be deemed to be a first offence.",
  "citations": [
    {
      "act": "Consumer Protection Act, 2019",
      "chapter": "VIII",
      "section": "96",
      "subsection": "(3)"
    }
  ],
  "references": [],
  "metadata": {
    "jurisdiction": "India",
    "language": "en",
    "version": "2019"
  }
}