{
  "id": "CPA2019-CH3-S15-1",
  "node_type": "section",
  "act_id": "CPA2019",
  "chapter_number": 3,
  "section_number": "15",
  "subsection_number": "(1)",
  "term": null,
  "definition": null,
  "official_text": "The Central Authority shall have an Investigation Wing headed by a Director-General for the purpose of conducting inquiry or investigation under this Act as may be directed by the Central Authority.",
  "citations": [
    {
      "act": "Consumer Protection Act, 2019",
      "chapter": "III",
      "section": "15",
      "subsection": "(1)"
    }
  ],
  "references": [],
  "metadata": {
    "jurisdiction": "India",
    "language": "en",
    "version": "2019"
  }
}